[
  {
    "currencyCost": {
      "amount": 100000,
      "currency": "gold"
    },
    "description": null,
    "id": "recipe_npc_bamut_clk_pride_earth_01",
    "isSpecial": false,
    "npcId": "npc_bamut",
    "requirements": [
      {
        "itemId": "mat_cursed_leather_earth",
        "quantity": 100
      },
      {
        "itemId": "new_item_151",
        "quantity": 30
      },
      {
        "itemId": "new_item_174",
        "quantity": 50
      },
      {
        "itemId": "new_item_191",
        "quantity": 3
      }
    ],
    "result": {
      "itemId": "clk_pride_earth",
      "quantity": 1
    },
    "specialNote": null
  },
  {
    "currencyCost": {
      "amount": 100000,
      "currency": "gold"
    },
    "description": null,
    "id": "recipe_npc_bamut_clk_pride_fire_01",
    "isSpecial": false,
    "npcId": "npc_bamut",
    "requirements": [
      {
        "itemId": "mat_cursed_leather_fire",
        "quantity": 100
      },
      {
        "itemId": "new_item_157",
        "quantity": 30
      },
      {
        "itemId": "new_item_174",
        "quantity": 50
      },
      {
        "itemId": "new_item_192",
        "quantity": 3
      }
    ],
    "result": {
      "itemId": "clk_pride_fire",
      "quantity": 1
    },
    "specialNote": null
  },
  {
    "currencyCost": {
      "amount": 100000,
      "currency": "gold"
    },
    "description": null,
    "id": "recipe_npc_bamut_clk_pride_water_01",
    "isSpecial": false,
    "npcId": "npc_bamut",
    "requirements": [
      {
        "itemId": "mat_cursed_leather_water",
        "quantity": 100
      },
      {
        "itemId": "new_item_154",
        "quantity": 30
      },
      {
        "itemId": "new_item_174",
        "quantity": 50
      },
      {
        "itemId": "new_item_190",
        "quantity": 3
      }
    ],
    "result": {
      "itemId": "clk_pride_water",
      "quantity": 1
    },
    "specialNote": null
  },
  {
    "currencyCost": {
      "amount": 100000,
      "currency": "gold"
    },
    "description": null,
    "id": "recipe_npc_bamut_clk_pride_wind_01",
    "isSpecial": false,
    "npcId": "npc_bamut",
    "requirements": [
      {
        "itemId": "mat_cursed_leather_wind",
        "quantity": 100
      },
      {
        "itemId": "new_item_160",
        "quantity": 30
      },
      {
        "itemId": "new_item_174",
        "quantity": 50
      },
      {
        "itemId": "new_item_193",
        "quantity": 3
      }
    ],
    "result": {
      "itemId": "clk_pride_wind",
      "quantity": 1
    },
    "specialNote": null
  },
  {
    "currencyCost": {
      "amount": 500,
      "currency": "gold"
    },
    "description": null,
    "id": "recipe_npc_bamut_mat_cursed_leather_earth_01",
    "isSpecial": false,
    "npcId": "npc_bamut",
    "requirements": [
      {
        "itemId": "mat_chimera_snake",
        "quantity": 5
      }
    ],
    "result": {
      "itemId": "mat_cursed_leather_earth",
      "quantity": 1
    },
    "specialNote": null
  },
  {
    "currencyCost": {
      "amount": 500,
      "currency": "gold"
    },
    "description": null,
    "id": "recipe_npc_bamut_mat_cursed_leather_fire_01",
    "isSpecial": false,
    "npcId": "npc_bamut",
    "requirements": [
      {
        "itemId": "mat_chimera_lion",
        "quantity": 5
      }
    ],
    "result": {
      "itemId": "mat_cursed_leather_fire",
      "quantity": 1
    },
    "specialNote": null
  },
  {
    "currencyCost": {
      "amount": 500,
      "currency": "gold"
    },
    "description": null,
    "id": "recipe_npc_bamut_mat_cursed_leather_water_01",
    "isSpecial": false,
    "npcId": "npc_bamut",
    "requirements": [
      {
        "itemId": "mat_chimera_dragon",
        "quantity": 5
      }
    ],
    "result": {
      "itemId": "mat_cursed_leather_water",
      "quantity": 1
    },
    "specialNote": null
  },
  {
    "currencyCost": {
      "amount": 500,
      "currency": "gold"
    },
    "description": null,
    "id": "recipe_npc_bamut_mat_cursed_leather_wind_01",
    "isSpecial": false,
    "npcId": "npc_bamut",
    "requirements": [
      {
        "itemId": "mat_chimera_goat",
        "quantity": 5
      }
    ],
    "result": {
      "itemId": "mat_cursed_leather_wind",
      "quantity": 1
    },
    "specialNote": null
  },
  {
    "currencyCost": {
      "amount": 0,
      "currency": "gold"
    },
    "description": null,
    "id": "recipe_npc_bartel_item_kukulkan_box_basic_01",
    "isSpecial": false,
    "npcId": "npc_bartel",
    "requirements": [
      {
        "itemId": "mat_kukulkan_basic_down",
        "quantity": 1
      },
      {
        "itemId": "mat_kukulkan_basic_up",
        "quantity": 1
      }
    ],
    "result": {
      "itemId": "item_kukulkan_box_basic",
      "quantity": 1
    },
    "specialNote": null
  },
  {
    "currencyCost": {
      "amount": 0,
      "currency": "gold"
    },
    "description": null,
    "id": "recipe_npc_bartel_item_kukulkan_box_high_01",
    "isSpecial": false,
    "npcId": "npc_bartel",
    "requirements": [
      {
        "itemId": "mat_kukulkan_high_down",
        "quantity": 1
      },
      {
        "itemId": "mat_kukulkan_high_up",
        "quantity": 1
      }
    ],
    "result": {
      "itemId": "item_kukulkan_box_high",
      "quantity": 1
    },
    "specialNote": null
  },
  {
    "currencyCost": {
      "amount": 0,
      "currency": "gold"
    },
    "description": null,
    "id": "recipe_npc_bartel_item_osiris_box_basic_01",
    "isSpecial": false,
    "npcId": "npc_bartel",
    "requirements": [
      {
        "itemId": "mat_osiris_basic_down",
        "quantity": 1
      },
      {
        "itemId": "mat_osiris_basic_up",
        "quantity": 1
      }
    ],
    "result": {
      "itemId": "item_osiris_box_basic",
      "quantity": 1
    },
    "specialNote": null
  },
  {
    "currencyCost": {
      "amount": 0,
      "currency": "gold"
    },
    "description": null,
    "id": "recipe_npc_bartel_item_osiris_box_high_01",
    "isSpecial": false,
    "npcId": "npc_bartel",
    "requirements": [
      {
        "itemId": "mat_osiris_high_down",
        "quantity": 1
      },
      {
        "itemId": "mat_osiris_high_up",
        "quantity": 1
      }
    ],
    "result": {
      "itemId": "item_osiris_box_high",
      "quantity": 1
    },
    "specialNote": null
  },
  {
    "currencyCost": {
      "amount": 0,
      "currency": "gold"
    },
    "description": null,
    "id": "recipe_npc_bartel_mat_crack_core_01",
    "isSpecial": false,
    "npcId": "npc_bartel",
    "requirements": [
      {
        "itemId": "mat_rift_shard",
        "quantity": 100
      }
    ],
    "result": {
      "itemId": "mat_crack_core",
      "quantity": 1
    },
    "specialNote": null
  },
  {
    "currencyCost": {
      "amount": 1000000,
      "currency": "gold"
    },
    "description": null,
    "id": "recipe_npc_bartel_wpn_qigu_obsidian_01",
    "isSpecial": false,
    "npcId": "npc_bartel",
    "requirements": [
      {
        "itemId": "mat_crack_core",
        "quantity": 2
      },
      {
        "itemId": "mat_rough_stone",
        "quantity": 30
      },
      {
        "itemId": "new_item_153",
        "quantity": 10
      },
      {
        "itemId": "new_item_156",
        "quantity": 10
      },
      {
        "itemId": "new_item_159",
        "quantity": 10
      },
      {
        "itemId": "new_item_162",
        "quantity": 10
      },
      {
        "itemId": "new_item_170",
        "quantity": 30
      }
    ],
    "result": {
      "itemId": "wpn_qigu_obsidian",
      "quantity": 1
    },
    "specialNote": null
  },
  {
    "currencyCost": {
      "amount": 0,
      "currency": "gold"
    },
    "description": null,
    "id": "recipe_npc_brabo_wpn_34_01",
    "isSpecial": false,
    "npcId": "npc_brabo",
    "requirements": [
      {
        "itemId": "new_item_169",
        "quantity": 50
      },
      {
        "itemId": "new_item_elfwing",
        "quantity": 1
      }
    ],
    "result": {
      "itemId": "wpn_34",
      "quantity": 1
    },
    "specialNote": null
  },
  {
    "currencyCost": {
      "amount": 0,
      "currency": "gold"
    },
    "description": null,
    "id": "recipe_npc_brabo_wpn_35_01",
    "isSpecial": false,
    "npcId": "npc_brabo",
    "requirements": [
      {
        "itemId": "new_item_169",
        "quantity": 150
      },
      {
        "itemId": "new_item_elfwing",
        "quantity": 3
      }
    ],
    "result": {
      "itemId": "wpn_35",
      "quantity": 1
    },
    "specialNote": null
  },
  {
    "currencyCost": {
      "amount": 0,
      "currency": "gold"
    },
    "description": null,
    "id": "recipe_npc_brabo_wpn_36_01",
    "isSpecial": false,
    "npcId": "npc_brabo",
    "requirements": [
      {
        "itemId": "new_item_157",
        "quantity": 3
      },
      {
        "itemId": "new_item_173",
        "quantity": 150
      },
      {
        "itemId": "new_item_elfwing",
        "quantity": 3
      }
    ],
    "result": {
      "itemId": "wpn_36",
      "quantity": 1
    },
    "specialNote": null
  },
  {
    "currencyCost": {
      "amount": 0,
      "currency": "gold"
    },
    "description": null,
    "id": "recipe_npc_brabo_wpn_40_01",
    "isSpecial": false,
    "npcId": "npc_brabo",
    "requirements": [
      {
        "itemId": "new_item_169",
        "quantity": 80
      },
      {
        "itemId": "wpn_39",
        "quantity": 2
      }
    ],
    "result": {
      "itemId": "wpn_40",
      "quantity": 1
    },
    "specialNote": null
  },
  {
    "currencyCost": {
      "amount": 0,
      "currency": "gold"
    },
    "description": null,
    "id": "recipe_npc_brabo_wpn_41_01",
    "isSpecial": false,
    "npcId": "npc_brabo",
    "requirements": [
      {
        "itemId": "new_item_157",
        "quantity": 3
      },
      {
        "itemId": "new_item_173",
        "quantity": 80
      },
      {
        "itemId": "wpn_39",